{
  "$schema": "https://json-schema.org/draft/2020-12/schema",
  "$id": "https://eips.ethereum.org/assets/eip-9999/schemas/kya-scheme.schema.json",
  "title": "KYA Scheme Descriptor v1",
  "description": "Off-chain descriptor referenced by IKYASchemeRegistry.Scheme.schemeURI. Holds the KYA principle; the chain holds only its address, hash, mode and verifier.",
  "type": "object",
  "required": ["type", "name", "description", "version", "mode", "dimensions", "levels"],
  "additionalProperties": true,
  "properties": {
    "type": { "const": "https://eips.ethereum.org/EIPS/eip-9999#kya-scheme-v1" },
    "name": { "type": "string", "minLength": 1, "maxLength": 200 },
    "description": { "type": "string", "minLength": 1 },
    "version": { "type": "string", "pattern": "^[0-9]+\\.[0-9]+\\.[0-9]+$" },
    "mode": { "type": "string", "enum": ["attested", "proved"] },
    "dimensions": {
      "type": "array", "minItems": 1, "uniqueItems": true,
      "items": { "type": "string", "pattern": "^[a-z0-9][a-z0-9-]*$" },
      "description": "Open vocabulary. Registered initial values: controller-binding, provenance, capability, accountability, behavioral, compliance, runtime-integrity."
    },
    "levels": {
      "type": "object",
      "description": "Map from level (decimal string 0-255) to semantics. Level 0 MUST be present and mean 'not verified / failed'.",
      "required": ["0"],
      "propertyNames": { "pattern": "^([0-9]|[1-9][0-9]|1[0-9]{2}|2[0-4][0-9]|25[0-5])$" },
      "additionalProperties": {
        "type": "object",
        "required": ["label"],
        "properties": {
          "label": { "type": "string" },
          "description": { "type": "string" },
          "erc8004Response": { "type": "integer", "minimum": 0, "maximum": 100, "description": "Value a KYA Bridge SHOULD mirror into the ERC-8004 Validation Registry for this level." }
        }
      }
    },
    "evidenceKinds": {
      "type": "array", "uniqueItems": true,
      "items": { "type": "string", "pattern": "^[a-z0-9][a-z0-9-]*$" },
      "description": "Open vocabulary. Registered initial values: erc8004-reputation, erc8004-validation, vc-jwt, vc-ld, tee-quote, zk-proof, domain-proof, payment-history."
    },
    "issuerPolicy": {
      "type": "object",
      "description": "Declares who may issue under this scheme. Declarative only — the framework does not enforce it.",
      "required": ["kind"],
      "properties": {
        "kind": { "type": "string", "enum": ["open", "allowlist", "staked", "governed", "verifier-only"] },
        "uri": { "type": "string", "format": "uri" },
        "issuers": { "type": "array", "items": { "type": "string", "pattern": "^eip155:[0-9]+:0x[0-9a-fA-F]{40}$" } }
      }
    },
    "circuit": {
      "type": ["object", "null"],
      "description": "REQUIRED (non-null) when mode == proved.",
      "required": ["system", "vkHash", "publicInputLayout"],
      "properties": {
        "system": { "type": "string", "examples": ["groth16", "plonk", "stark", "semaphore", "tee-quote"] },
        "vkHash": { "type": "string", "pattern": "^0x[0-9a-fA-F]{64}$" },
        "publicInputLayout": {
          "type": "array", "minItems": 1,
          "items": { "type": "string" },
          "description": "Ordered names of ABI-encoded public inputs. MUST include subjectKey and nullifier. Canonical layout 'kya-public-v1': [subjectKey, nullifier, level, claimDigest, expiresAt, issuerSetRoot, epoch]."
        },
        "publicInputAbi": { "type": "array", "items": { "type": "string" }, "description": "Solidity ABI types matching publicInputLayout, e.g. [\"bytes32\",\"bytes32\",\"uint8\",\"bytes32\",\"uint64\",\"bytes32\",\"uint64\"]." },
        "nullifierScope": { "type": "string", "enum": ["scheme", "scheme-epoch"], "default": "scheme" },
        "epochSeconds": { "type": "integer", "minimum": 1 },
        "issuerHiding": { "type": "boolean", "default": false }
      }
    },
    "predecessor": { "type": "string", "pattern": "^0x[0-9a-fA-F]{64}$" },
    "documentation": { "type": "string", "format": "uri" }
  },
  "allOf": [
    {
      "if": { "properties": { "mode": { "const": "proved" } } },
      "then": { "required": ["circuit"], "properties": { "circuit": { "type": "object" } } }
    }
  ]
}
